<?xml version="1.0" encoding="UTF-8"?>
<circuito xsi:noNamespaceSchemaLocation="circuito.xsd" xmlns:xsi="http://www.w3.org/2001/XMLSchema-instance">
  <nombre>Red Bull Ring - Spielberg</nombre>
  <longitud medida="m">4300</longitud>
  <anchura medida="m">12</anchura>
  <fecha fechaISO="2025-08-17">Domingo 17 de agosto de 2025</fecha>
  <hora>14:00h</hora>
  <vueltas>28</vueltas>
  <localidad_proxima>Zeltweg</localidad_proxima>
  <pais>Austria</pais>
  <patrocinador_principal>Bwin</patrocinador_principal>

  <bibliografia>
    <referencia nombre="The Official Home of MotoGP" enlace="https://www.motogp.com/es/calendar/2025/event/austria/2691a49e-a593-4119-8fe4-826017d5f2dd?tab=overview"/>
    <referencia nombre="Motorbike Magazine" enlace="https://www.motorbikemag.es/horario-motogp-gp-austria-red-bull-ring-fecha-hora-carreras/"/>
    <referencia nombre="DAZN" enlace="https://www.dazn.com/es-ES/news/motor/circuito-red-bull-ring-donde-esta-como-es-caracteristicas-como-llegar-fotos-escenario-gp-austria-mundial-f1-motogp/11mzmm2gb230a1fcbe6anph2tc"/>
  </bibliografia>

  <fotografia>
    <imagen nombre="recta" src="multimedia/recta.jpg"/>
    <imagen nombre="curva" src="multimedia/curva.jpg"/>
  </fotografia>

  <multimedia>
    <video nombre="Circuito" src="multimedia/circuito.mp4"/>
  </multimedia>

  <origen nombre="Punto de origen de la pista" longitud="14°45'54E" latitud="47°13'12N" altitud="677"/>

  <puntos>
    <tramo distancia="800" unidad="m" sector="1">
      <fin longitud="14°45'58E" latitud="47°13'15N" altitud="678"/>
    </tramo>
    <tramo distancia="700" unidad="m" sector="2">
      <fin longitud="14°45'56E" latitud="47°13'20N" altitud="679"/>
    </tramo>
    <tramo distancia="600" unidad="m" sector="3">
      <fin longitud="14°45'51E" latitud="47°13'18N" altitud="676"/>
    </tramo>
    <tramo distancia="700" unidad="m" sector="4">
      <fin longitud="14°45'48E" latitud="47°13'14N" altitud="675"/>
    </tramo>
    <tramo distancia="600" unidad="m" sector="5">
      <fin longitud="14°45'50E" latitud="47°13'10N" altitud="676"/>
    </tramo>
    <tramo distancia="900" unidad="m" sector="6">
      <fin longitud="14°45'54E" latitud="47°13'12N" altitud="677"/>
    </tramo>
  </puntos>

  <vencedor nombre="Marc Márquez" tiempo="42:11.006"/>

  <clasificacion>
    <piloto puesto="1" nombre="Marc Márquez" puntos="545"/>
    <piloto puesto="2" nombre="Álex Márquez" puntos="362"/>
    <piloto puesto="3" nombre="Francesco Bagnaia" puntos="274"/>
  </clasificacion>
</circuito>
